dream,archetype
"Raptors were after us. I was in a big old fashioned hotel of sorts; more like people lived there in many rooms. Raptors are in the hotel and we're trying to find places to hide. (There's a kid with me and I forget who else.) I trying to hide in different places but never find one satisfactory. I try stuffing myself, slat by slat between the wooden slats under the bed and the mattress, but this actually feels very exposed and like the wood might snap, attracting dinosaur. I wanted to be wrapped up in several several blankets and have boxes and things stacked in front of me in a closet, or hide my face amongst stuffed animals like an E.T., but all this moving is making noise and there isn’t adequate stuff to cover me. I'm making noise and time is running out. For all I know I'm attracting the things which are certainly killing people in this huge boarding house/hotel. I cross the hall and chance finding a hiding spot in another room, when I decide on a real solution and slip outside the window and I'm standing on winging bricks that wrap around the building like in a Hitchcock movie. I remember I've dreamed the same dream before and the raptors can scale and climb all over the outside of the building, too. But I don't see any. Finally I decide, screw this place, and run across the lawn toward traffic. Now my lovely friend is there with me and now a raptor is chasing us both. It seems obvious that the raptor is going to catch us, but she yells out that we've beat it before, like everything will be fine, and indeed we make it into traffic. I'm hoping it will be hit. We make it into a parked food truck, where men are working. The fear of raptor-pursuit is greatly reduced. I tell them to take me anywhere but there. Rebecca, on the other hand, confidently tells them to drop her right back off by the front of the lawn and confidently struts back toward the hotel. This is right after I say the words out loud ""take me anywhere but there"". ;  Background_Info: Years ago I'd dream about dinosaurs and the end of the world a lot. I don't know about raptors. There used to be a lot of holding still In the presence of T-Rex. ;  Wakeup_State: I woke up to a blizzard blowing in through the back door then Los Lobos singing La Bamba started playing on my phone. ###",hero
"I had a dream that I had a bunch of puppies in my house & an aggressive dog got in & started taking all the puppies one by one & putting them in a tent in the back garden I was crying & hiding terrified. It was dark & rainy in the garden & every time the dog was bringing one out I was bringing one back in trying to save them but hiding so I wasn’t seen. I was going back & forth when I realised one of the puppies were drowning in a paddling pool that was filling fast with the rain, I tried to save the puppy but I couldn’t, the aggressive dog wouldn’t stop barking at me & biting at my clothes but I was just crying holding this dead pup in the rain.",everyman
"I was attacked by this older man who chased me except I didn't experience it in the dream, I just knew he had caught me after running away and watched him leave my apartment (this is now the 7th night in a row I've been chased by him but not caught until now. It's worth mentioning that I always know I'm dreaming and try to ""wake up"" so that I can make him stop chasing me but I'm always unable and he gets too close for comfort so I run away). Anyways, when he leaves, I escape out my apartment balcony by jumping and land safely, feeling guilty for leaving my dog behind. I sprint to catch the bus and when I board it, I begin to question if I am dreaming. I can't think around the fact that the dream took place in my apartment for a moment, but I work around that by considering that the apartment I just saw was unpainted and I recently painted mine, and that I escaped bgy jumping which would be impossible. I suddenly wake up and can't tell if I'm dreaming or really on the bus so I ask the woman in front of me, ""excuse me Bonnie, where is this bus going?"" Because I knew if she answered then I was obviously dreaming since I could call her anything and have her answer. She said something like, ""Oh well, things are going all over the place these days and I can't hardly ever keep track. I just go for the ride."" I woke up and told the bus to stop, which it did and all the passengers froze. Next, I pointed to the ground and wanted for my dog to be there and he appeared and listened when I told the dream that he needed to be a good boy (he lay down and smiled). Next, I closed my eyes, told the bus to go to a lavender field on a beach instead, and when I opened my eyes the bus pulled up near a beautiful beach where I stepped off, smelt the sea air and lay in the field to relax. I haven't had the horrible dream of being sexually chased since.",everyman
"After walking up a long set of stairs, I reached a road and a bird came down and attacked a small snake hiding in some short grass. At first it looked like the bird had the snake, but the snake twisted out and got free. The bird attacked again, and this time the snake bit the bird as they were struggling. The bird dropped the snake, and the snake bit me, before the bird grabbed it again. I was initially worried, as I've encountered snakes a lot in my last job, but then realised it was probably too small to hurt me. I didn't recognise the species of bird or snake, but the snake wasnt big (30-40cm).",wizard
"I dreamed I had to go and pick up an old friend. He was going to be homeless. He told me he was going to break into a jail where his friend was being incarcerated and stay with him. He has a big rucksack, he asks me ""How big do you think the cell is?"" I don't suppose there will be room for him, if all sounds very dodgy and like an impossible idea. I wonder if I shoukd ask him to stay with us but he has no money, no job and no plans, I'm not sure I can host him with such uncertainty. We drive to a small asian corner store. I go inside for a sandwich but it's all very busy with lots of foreign men. The sandwiches look really nice, so many fillings and different breads but they are all in a mess in all the refrigerators. I feel overwhelmed in there.",everyman
"I found myself with my family, with a sister that I don't know. Somehow accidently I hurt my sister and my father started applying bandages on her. Then I saw a rainstorm and just after that, a flood making water level as high, enough to cover up ground and 1st floor level. I saw a red car going to right if my house and starts struggling to get out the water (off course water already covered ground and 1st floor, no way to get our of water) and slowly starting submerging. However, the driver was able to open the car door and try to jump on one of the roof of the house whose tip was still not fully submerged, and he was successfull (car colour was red). As water level was rising and me and my family was still on 1st floor, I rushed in the rooms and try calling my father to come and go to upper level (my house has total ground, 1st, 2nd and 3rd level as a roof (accessible)) and I started collecting warm clothes, blanket with me to take to another level. But when I came out of the room, I saw water level gone down a bit (like 40%) and the current 1st level floor was safe and now there was no need to go to next level. Then, I saw the family and the guy (who successfully took out and jumped on the tip of other's house roof, mentioned earlier) in the balcony of same other's house. ;  Background_Info: The other's house that I see in the dream and the house I was in are both real in real life. Others house is my neighbour s house. The family I saw is known and real except that girl that I hurt in the dream ;  Wakeup_State: __ ###",everyman
So I had a dream that I was driving without insurance and was hit on the driver side. I left the scene of the accident and still went to MC Donald’s. the girl in the car was a girl who didn’t like me from the past over a guy. she said she was completely hurt in the wreck. However when I got back to the scene she was gone and I seen my driver door returned to normal. We hired a private investigator.,everyman
"I found myself in a hospital room. I don't know how I got there or why I was there, the room was pleasantly sunny. I wasn't scared but rather calm and fully okay with the situation, almost contempt. I was visited by a man my age whom I don't know in real life, he seemed to be sort of a partner to be. When he left I was visited by yet another man, my ex partner. I don't recall if there was any conversation but the spirits were high and there was also no sense of distress to the situation, it was like meeting an old friend that you still hold a lot of affection for because you simply like the person. Then he also left. Now off to the part I'm most intrigued about. When I was left alone the feeling of a quiet contentment persisted. I found myself holding up a small mirror and looked into it. To my absolute surprise, my face above the eye line was split open. The opening starting from around the space between my eyebrows. I recall the skin hanging to the right side (in the mirror). I was surprised but nowhere near in a state in which I would be if this happened to me in real life. Trust me, I like my face the way it is. In the dream the feeling was that of curiosity. I looked inside my head and there to the right I found two pieces of some type of long, beige, spongy material. I was under the impression that I had undergone a brain surgery and the pieces were there to hold the hemisphere in place. What's worth noticing is that I felt the operation happened years earlier and wasn't the reason I was now in the hospital room. Another thing I very strongly recall is that my left (in the mirror) side of the brain was hurting me, it was inflamed. I had to wake up at that point as I don't recall anything past that. ;  Background_Info: Now, it would be worth adding that some time ago I had a very powerful experience that shifted my perception in such a drastic way I was able to immediately stop drinking alcohol after a decade of killing myself with it. It was the main but not the only positive change that followed my experience. I feel like myself again after a lifetime of living in a state of dissociation. ;  Wakeup_State: __ ###",lover
"I had a dream last night. I was leading a large group of men to a door. Everyone is wearing dark suits with white ties. I knock three times. An older man with a beard opens the door and lets me in. We sit down opposite each other at a quadratic black table. The floor is like a chess board. Behind it, and the host, is a black staircase that goes up, and towards the left. Between us, to his right, sits a little girl in a white dress. Her task is to ask me questions to prove my innocence, before I am let in.",everyman
"I'm driving a car in a world I am familiar with, it's a video game world, more specifically the Grand Theft Auto world. (I’ve never really played the game by the way, IF I played it, my time was spent driving around legally, not even speeding. So it’s safe to say I haven’t really played it) I realize the cops are chasing me, no small amount of cops, cars and policemen on foot. I'm an evil man (woman in real life btw which is interesting as well), a criminal. I drive fast and recklessly and I’m running through several doors, up and down stairs….Soon I've gotten rid of the cops, they're not after me anymore. I'm in an empty house that’s still being built, it’s basically still just an iron structure (similar to the one in The Dark Knight when Batman and Joker battle)…I'm not alone, Aragorn (Lord of the Rings) is there fighting me and he has a sword, I also have a sword. We are hanging on iron pillars and fencing. I get a hold of his sword and I kick him off the building, I watch him fall while I hang there. When he hits the ground I look up at the building, there I see millions of faces / heads on the building - like manikin heads. I instantly know it’s me, my face, but instead of it being my own real life face, I'm the Joker (Joker 2020 version) with a disgusting grin on its face. ;  Background_Info: Most times when I have a nightmare I am running away from evil, or in some other way trying to escape evil. This time I was evil running away from heroes. I loved the Joker 2020 movie. ;  Wakeup_State: __ ###",jester
"It was all centered around my partner and I getting errands done. We went to the grocery store and went to get haircuts and buy clothes but we only got to the shops half an hour before they closed but the staff let us stay in this store past closing and we chatted with them. Then we headed to see my partners family. I had a really large box with personal stuff in it, I can’t remember exactly what. I left it on the side of the road and throughout the day I went back and forth to it. The last time I went out to it, it was empty and I felt really sad about my things being stolen. I couldn’t remember what was in the box so I tried to just let it go and not be worried about it. ;  Background_Info: For context, in waking life my partner and I are going to her family’s place for lunch today for Mother’s Day. I also revealed some past trauma details to my partner the other day and as I type this out I am seeing parallels between that and the box on the road. Any interpretations are welcome and appreciated! ;  Wakeup_State: __ ###",lover
"I am in an underground activity, like an escape room but on a larger scale, like a labyrinth. There are lots of people walking around trying to find the way out, but getting nowhere. One of them is an old dancing partner when I was taking ballroom dancing lessons. I get the impression of a long time searching for the proper path. The focus of the dream is when I come to an old temple, Ancient Greek-ish with a large granite statue, specifically granite with a rustic pinkish hue. Looking up into the temple roof I realise no one is up there and it dawns on me that the path is likely up there as no one down here has found the way, so I head up there. The dream then goes to an out of body view of the path. There is an above ground bridge like structure, and the way corkscrews as a tunnel around it. Because its a tunnel everyone assumes its underground, but it isn't, its not logical. That's the trick.",explorer
"First night of dreaming: I was running away from a day time rain, the skies were a beautiful bright blue. It was coming after me, I didn’t want it to touch me. I was jumping from roof top to rooftop in a place that resembled the favela of Brazil. Suddenly there’s a helicopter and someone who I can’t see their face reaches their hand out to me and pulls me inside before the rain could touch me. I’m dry and saved. I wake up. Second night of dreaming: I’m now wet, the rain has touched me. I’m in a forest somewhere. There’s a women who feels like a spirit. I only see her from the back, I can’t tell her age wether she’s young or old, maybe she had white braided hair and wearing native clothes. she’s running somewhere and I feel like I must follow her, so I do. She leads me to shelter. I wake up. Third night of dreaming: I’m alone and dry. I’m on a beach somewhere, and in the distance of the horizon is the most magical scene I’ve ever seen. There’s a massive tsunami wave touching the skies like it was reaching out for heaven, wide as the eye can see everywhere I look from left to right. It stayed in it’s place, just flowing up, it wasn’t coming after me. The sunset was shining through it, illuminating its power and beauty. I was in awe and wonder, mesmerized and unafraid. I felt empowered. ;  Background_Info: I dreamt over three consecutive nights with the element of water in it… ;  Wakeup_State: __ ###",everyman
I dreamt that his identical brother died. The dream was so vivid. I remember being really worried about Earl. I was looking everywhere for him to see if he was okay. I finally found him and he was just standing there smiling at me. I ran up to him and told him I was sorry about the loss of his brother and he didn't say a word he just kept smiling. I went to hug him and it was one of those really long hugs that you don't want to end. ;  Background_Info: Years ago after I split up with my son's father I started seeing a man named Earl. We had a really good time together. I really liked him. He had problems though and he drank way too much. He would get sloppy drunk almost every day. So I had to break it off with him. I didn't want to but I couldn't help him and at the time I had a 3 year old to care for that didn't need to be around a falling down drunk. It broke his heart when I ended things. He blew my phone up for over a week begging me for another chance. I stood my ground and kept telling him no. One evening my son and I were at a friend's house when he showed up crying drunk still begging me. I was annoyed so I grabbed my son and we went home and went to bed.  ;  Wakeup_State: Then I woke up. About 10 mins after I woke his sister called me to inform me that he had passed away in the night. He overdosed. Am I crazy for thinking that really wasn't a dream? I believe his soul was telling me goodbye. ###,lover
"In the dream I was swimming in a pool at a beautiful resort. I called my crush on the phone, and she didn't seem interested to talk to me much. She hung up. I raised my eyes and I saw her by the pool, taking pictures. I swim to her and I try some small talk. Im really happy to see her. I say something like ""you know what. I really like what I see now"". In the dream she was pretty although she wore more makeup than her real life version. She pretty much dismissed what I told her and she started to say the cleaning guy she saw earlier was cute. This was like a slap in the face for me. ;  Background_Info: Obsessing over the girl in my dream. She is a colleague of mine. I thought she had some interest in me, but lately I'm experiencing serious doubts about that, which drives me nuts. ;  Wakeup_State: __ ###",creator
It was me another female and a man I couldn't see what the other female fully looked like but I had a feeling she was beautiful nor could I see what the man looked like fully I seen his body and smile his smile was also beautiful! In the dream the relationship I felt with this other female was a intimate relationship but not sexaully intimate much deeper than sexaul i was talking to the man and told him I wanted to give him something that I've loved so much and as I was saying this to him she come around the corner he smiled with most beautiful and loving smile I took her hand and put it in his hand and the feeling of complete safety and the amount of love that was felt was amazing all these feeling was happening in the dream but I could feel them as if I was awake and after I gave him her hand. ;  Background_Info: I do have dreams that end up being reality sometimes but I never know for sure til it happens I just get a overwhelming feeling that a certain dream is more than just a dream I also had this feeling with this dream I hope I've made sense im just looking for opinions on what this could mean im sure I will eventually find out but I tend to be impatient! ;  Wakeup_State: __ ###,lover
"I was going into and old house with my friends. Like an old motel room. Everything was filthy, but comfy. The reason we were going there was to investigate Annabelle. We went to sleep, and I told them if anything happened they should scream and alert the rest of us. We were 4, me and 3 good friends I could not recall. When we went to sleep, she appeared, but when I tried to scream, a shadow person, tall andwierdly shapen, bent over me with an open mouth, and I felt I slowly lost the ability to scream, even though I really couldn't from the start.",jester
"The sense of place has a strange feel to it despite the mundane descriptions. I'm in a city, I experience being aboard something like a stationary train or tram, I'm lacking a requirement to travel back on the train, I think I wish to buy a piece of cake before my return journey for some reason, but I'm trying to fish out my payment card and ID card and making other passengers wait, I see my bags on the floor unzipped, my belongings bulging out of them in an unorganized fashion as I fish around on my person for my cards, I feel the passengers impatience with me. Then I'm standing in something approximating a shopping mall, apparently attempting a different route of travel, standing in front of a phone with old fashioned handset in my hand like those of old phone boxes. I lift up the handset a couple of times, the unusual looking digital screen flickers slightly but fails to spring to life, I lift it a third time and the phone and display then connects successfully. I speak in a slightly shakey voice, stating that I wish to attain something, perhaps this cake I'm after by relaying my card details, to then travel back by alternative means, perhaps by car, and the natural sounding voice I recognize as artificial intelligence identifies by the sound of my voice that I am somehow unfit, as though drunk and intending to drive, only not that, and manages to deduce I'm breaching some rule in what I am asking, recognizing I must be traveling back by a method I'm unfit to do in this circumstance, based upon my request. I'm then elsewhere walking on some dim grey street, having traveled another different route, I see a person walking in front of me, I recognize them as a second instance of an identical person I've just seen at the opposite end of the road I'm walking down, beyond them I see an oddly distinct looking vehicle drive around the corner of a road, at that moment another identical vehicle drives around the same corner in the opposite direction. Then I find myself at a different scene, looking at a damaged, blackened decrepit shell of a helicopter leaning towards the edge of a small muddy pit of water beside it. I pan my head right and there is a small glass cubicle, like the glass cockpit of a crane or digger, with a man sat inside it. Beside him is a cake, he asks me what size slice I'd like, I gesture with my finger and thumb the thickness, but my hand is shakey, I worry this looks suspect somehow, I hold my hand with my other hand to steady it, struggling to indicate a sufficient thickness of slice. He serves me a slice of cake within two slices of bread, like a sandwich with some salad in it also. A bit odd, I thought. I took a bite, I sense the cool temperature of the salad. I ask the person that served me the cake 'what month were you born in?' as if to inquire his relatedness to me, as one might enquire to infer anothers zodiac sign. He says 'I was born in such-and-such a year', (I forget the actual year) clearly failing to understand the concept of a month, answering like a somewhat poorly programmed artificial intelligence humanoid. Then I'm in a car with this person and also my dad, setting off somewhere. My dad begins speaking, addressing this misunderstanding, he says ""this is sometimes the case when people suffering with dementia..."" - and I tell him to drop the subject, knowing this person is some form of artificial intelligence humanoid that may be irritated, or alerted to something being amiss. ;  Background_Info: Before bed I had a conversation on alerted states of consciousness and the fundamental 'patterns' of reality perceived in them, expressible only by form of symbols, like with number & math ;  Wakeup_State: __ ###",everyman
"Raptors were after us. I was in a big old fashioned hotel of sorts; more like people lived there in many rooms. Raptors are in the hotel and we're trying to find places to hide. (There's a kid with me and I forget who else.) I trying to hide in different places but never find one satisfactory. I try stuffing myself, slat by slat between the wooden slats under the bed and the mattress, but this actually feels very exposed and like the wood might snap, attracting dinosaur. I wanted to be wrapped up in several several blankets and have boxes and things stacked in front of me in a closet, or hide my face amongst stuffed animals like an E.T., but all this moving is making noise and there isn’t adequate stuff to cover me. I'm making noise and time is running out. For all I know I'm attracting the things which are certainly killing people in this huge boarding house/hotel. I cross the hall and chance finding a hiding spot in another room, when I decide on a real solution and slip outside the window and I'm standing on winging bricks that wrap around the building like in a Hitchcock movie. I remember I've dreamed the same dream before and the raptors can scale and climb all over the outside of the building, too. But I don't see any. Finally I decide, screw this place, and run across the lawn toward traffic. Now my lovely friend is there with me and now a raptor is chasing us both. It seems obvious that the raptor is going to catch us, but she yells out that we've beat it before, like everything will be fine, and indeed we make it into traffic. I'm hoping it will be hit. We make it into a parked food truck, where men are working. The fear of raptor-pursuit is greatly reduced. I tell them to take me anywhere but there. Rebecca, on the other hand, confidently tells them to drop her right back off by the front of the lawn and confidently struts back toward the hotel. This is right after I say the words out loud ""take me anywhere but there"".",hero
