dream,archetype
"The dream was that a significantly older man was chasing after me and wanted to perform unwanted sexual acts on me. It was quite disturbing. On Friday night though, as I was running away, I moved into another dream where I was running down a stone cavernous hallway. I'm running away from something but I'm not sure what. I keep coming to wooden doors with ironwork designs on them and unlocking them with my old fashioned, black iron key. From around the right corner, before I run to each door, there is a woman with dark hair and eyes in a pink dress towing a mule on a rope. She walks around the corner before I run down the hallway where each door is so I see her 3 or 4 times as if I'm running down the same hallways again 4 times. I never look to see if she is coming from somewhere so I don't know if there is actually a corridor she's coming from. Eventually, I run through one of the doors and there was a white field. I hear a voice behind me and it's a futuristic-looking boy of about 18 (picture cyberpunk goggles and dystopian future-looking clothing). He says something and before I can hear it, I realize I'm dreaming, wake up and I ask him, ""What are you doing here? Who are you? Why am I having this dream and what and I supposed to learn?"" He smiles coyly and says I can only learn that if I promise I'm still dreaming. I say yes and he leads me back around to where I previously saw the next wooden door in the fully white field, but now there is cobblestone and an old town. I've been here before but only during summer when he place looked like a mystical campground. Now it looks dark, cold and snowy. All the people are silhouettes and faceless. The boy leads me around the block and speaks but I can't really hear him. I'm more focused on the silhouette people (if you've seen inception, the people moved in a similar way except they were only shadows). There was also nobody in the houses. As we round the second last corner of the block, I tell the boy I changed my mind and that I want to go through the wooden door instead. He asks if I'm sure and when I say yes, I suddenly become quite cartoonish and dive through the wooden door like a superhero. My brother and I not fly through space as I chose the video game as if we are at a starting screen. I choose a game called SMASH and play as a miniature gorilla with veins all over its body except this character is MY body in the same way that Ready Player One works. I win enough fights that I get chosen as a champion for the last round where I fight against a blue zombie girl who rips my nervous system out of my body with her tongue and my fiance catches me and tells me it's okay and that my real-life body won't be affected, but I was terrified I would be horribly injured in real life.",everyman
"We were at the house and decided we needed to go to the store for a couple things, I caught my brother leaving the door unlocked so I told him and my mom to go ahead of me and I locked everything behind me. We go to the store get what we need and head outside, my mother and I saw something we wanted and told my brother to go get in the car. We came out 2 minutes after him and I put the stuff in the car look in the back seat and the door is open but he is gone. I begin to freak out and we start to drive around while trying to call the cops when he comes out of no where all beat up. We begin to drive him to the hospital when he tells me it’s cause the house was locked and the robbers couldn’t get in. I felt panicked and upset. ;  Background_Info: I take care of my little brother, but we have been having a lot of behavioral issues with him at home and school, he also does not respect me or my husband. ;  Wakeup_State: __ ###",rebel
I had a dream last night where I was like in the store with my boyfriend and this girl who I don't recognize from real life seem to have a platonic connection to him but also seem to like maybe have had something with him in the past whether she had a crush on him or he had a crush on her or something in the dream.. was like going up to him and like rubbing his back and like touching him and stuff and though it seemed platonic I was like there too and then people kept commenting on how great their chemistry was when they weren't dating and then I was feeling really stupid trying to grab his hand and feeling like I was being pushy or something.. witching like real life this is not how our dynamic act is at all like there's no girl threatening or anything,everyman
"One moment, I was back in high school classrooms, taking notes on my computer and missing lectures and assignments. The next, I was on the school's backlot watching as Sandman from Spider-Man somehow infused his sand with Peter Parker's friends, causing them to melt. Spidey then showed up and invented a a spray that reversed the effects and restore his friends. From the people who came back, I joined them and we established a village. However, a physical fight with someone caused me to get amnesia. A gal pal from college then appeared wearing a bikini and I didn't recognize her, but was intrigued by her Crush soda drink. I don't remember exactly what I said, but it was something along the lines of ""It's funny you're drinking that cuz you're my crush"". ;  Background_Info: Just last night, I had a hodge podge of stuff in my dream, which is typical for me. ;  Wakeup_State: __ ###",everyman
"I was at a beach, and there was an odd looking vehicle a bit like a tractor with its large back wheels, except this vehicle had no visible wheels at the front, and even larger rear wheels. I was aware that it was once above the sea level, on the sandy banks of the beach, but time had passed and I then witnessed it submerged just below the surface of the sea. I saw some people disappear below the water level and apparently get into the cabin, when it then rapidly, with unusual speed power and ease, reversed out of where it was submerged sunken in the sand offshore, back up onto the high sandy banks of the beach. Then this event was set back in time, ready to replay again, only with myself as an active participant in it, needing to prepare to do what I'd seen the people do - get into the cabin, and get the vehicle back out the sea onto the steep, sandy banks of the beach. There were a couple of odd scenes that were never seen or featured when I witnessed the first overview of events initially, I had a one half of a plastic clip like that found on a backpack or luggage (pictured), partly broken, which was presumably attached to the vehicle at one end, that I connected to the other half of the clip presumably attached to the sandy bank, one of the actual plastic clips was broken but I connected it to the other half precariously. I recall mentioning how seemingly ridiculous this feeble link was for the job at hand. Then, equally absurdly, I was handling some thin string which again might've been attached to the clip, which I was threading onto something fixed on the bank on the beach. Then was a sense of time urgency, and I along with a few others were standing atop the steep sandy banks of the beach, preparing to head to the sunken vehicle, submerge ourselves in the cold ocean and enter the cabin before getting the vehicle out from beneath the sea, where it was stuck deep into the sand, submerged. We were putting on wetsuits. I asked another ""do I need to take my top off?"" before putting on the wetsuit, ""yes"". Putting my arm into the sleeve of the suit I noticed just how thick the material was, several inches thick, enough to keep me from being shocked from the cold ocean temperature, so thick I might not even notice the temperature change at all. ;  Background_Info: I had this dream after I'd already woken once, my sleeping pattern has been terrible this last year. Dreams I recall tend to occur in this time of light, broken sleep, somewhere between sleep and wake. ;  Wakeup_State: __ ###",explorer
"So the dream before waking this morning was that I was in a house which felt like my previous home (which we sold almost two years ago) but it wasn't the same layout we were moving out in the dream. As with this dream, myself, my husband and some of my his family members were in a room that we had to clear out but there was a feeling that everything in the room was new to me, the first time I saw it. Like the furniture and the drawers were full of jewellery and ornaments which felt like they were the previous owner's and there were antique dressers and cupboards etc. All full of treasures I felt I wanted to keep as I was discovering them for the first time and I did not want to clear any of them out! Many of the dreams about houses are of the similar frequency in details.....always the house is old, there are many rooms and I keep looking for more, small or big and I sometimes find new items. Sometimes the dream is black and white but this mornings dream was in colour as the jewellery was colourful. Especially a ring I found, as I held it I dropped it and had to bend down to look for it. I found it and specifically it was a round band, half in baguette cut emeralds. ;  Background_Info: I frequently dream of houses. ;  Wakeup_State: __ ###",everyman
"I was going to the bathroom, and as I sit on the toilet (which I don't think has so much to say here - I think it's just that that is the angle from which I most commonly see the bathroom :P), I notice that there's a young girl (maybe 16 or so) standing in front of the shower in the other corner of the bathroom. She is wearing an old white dress, somewhat like what you see below. Having her stand there is making me uneasy, funnily enough. She doesn't look scary or anything, though. There is some sense that I can choose to acknowledge her presence or not - as if her presence is only a suggestion.I choose to do so, and I ask her who she is. She simply lifts her arm and points her finger at me. At this point I immediately think to ask if she is my Anima, and so I do. She says no, however, but for some reason I don't quite believe her. She might be telling the truth, though - i couldn't say. I think I went on to ask her some other questions as well, but I don't really remember any more. One of them might have been 'what are you doing here', to which I recall no answer. I'm not sure how you might even have answered that question though, seeing as it would make sense for her to be there, if she is really a part of me, just the same way it makes sense for me to be there.",jester
"I'm watching a football game on a large screen tv with my family. My favorite football team is playing and about to run a trick play. As the play starts, tornado sirens go off and there is all this confusion. The camera guy is still focused on the player as the play is breaking down because of all the confusion. He throws the ball to the ground and panics. The camera then pans to the fans in the stands who are all just standing and watching this small funnel cloud go back and forth. I keep scrolling at the TV ""it's a tornado, dumbasses! Take cover!"" While my kids are screaming in disbelief. The crowd continues to stay in their seats until the funnel cloud strikes them causing a young couple to catch fire.",hero
"It started very weirdly I couldn't keep up with what was happening like my dream was jumping from place to place. Then I remember speaking to who i believe was my partner when I got upset and said its Christmas we should be celebrating, dancing etc. He goes downstairs comes back and says right come on then let's go dancing. I get up walk to the staircase (it isn't my own it's a big fancy house , I only live in a small council rented property). I get to the top of the staircase look down and my nans there. I can see her talk to her and hug her! I'm very confused she passed why was she there. In my dream state I knew that something wasn't right. Anyway we start walking to the pub it's in the middle of nowhere. Fantastic scenery surrounded by trees and views but the path is dangerous. Lots of cliff edges, deep slopes that sort of thing. My nan starts walking to the edges she's smiling and I'm scared she's going to fall. She says my name and just carries on. She falls off and lands on a larger person who breaks her fall and somehow they are both OK. She smiles and lends her hand as if to say I should take risks too its ok. ;  Background_Info: I often get very vivid dreams but this one was about my nan who has passed ;  Wakeup_State: I woke feeling like it was a message to stop letting fear control my life but have second guessed it thinking my nan didn't take risks why would she encourage me to in a dream? ###",everyman
"Last night I dreamt a typical, nondescript dream, but then my dream was interrupted. It quite literally felt like someone had hacked my brain with an extremely realistic and vivid video that was being broadcast; it almost felt like a subliminal message being flashed quickly. It was a dark forest at night as I faced a line of trees, presumably the edge of a forest. A metal sign hung from the middle tree in front of me that had the feeling of a No Tresspassing sign. Besides the illegible text at the top, there was an all-seeing eye right in the middle. Suddenly red and blue lights flashed behind it alternatively, like cop car lights, VIVIDLY and almost neon and overly saturated. Fog started rolling out behind the sign from the lights, and the “video” started zooming in slowly towards the sign while rotating. The focus was always on the sign. After that, I returned to my nondescript dream that I was in prior to that. It very much felt like someone had hacked my dream to show me this scene, like an urgent message. It didn’t feel like I personally was there, rather that someone had filmed it objectively with the intention of sending it to me.",wizard
"I had a dream my sister randomly bought a gold ring and proposed to my cousin who is a girl. I didn't feel good about it and tried to talk to them about it. But then there was an Indian couple that were my cousins parents (which that's not her parents in real life) And her parents were yelling at me and calling me homophobic for objecting against the marriage between my sister and my cousin, but I explained that's not true. I'm bisexual and support lgtbq+, that's not the problem. I was more worried about my sisters reckless spending. In buying a gold/diamond ring when she hardly has any money to survive and is in between homes. Even tho they are related so... That should have been a concern. But I was concerned about money. ;  Background_Info: I'm bisexual and support lgtbq+ ;  Wakeup_State: __ ###",everyman
"I find myself standing in from of a male version of myself. Being single, I go into my ""seduction mode"" - the male version says ""Mauny, it's not about THAT!"". At that moment, the two of us go up into the air in what I can only describe as an ascending 'helix' - like a strand of DNA, twisting around each other. The next moment I am with a cloaked, shorter figure that I know as ""Old Master"" . He leads me into a cave and there we look down on what looks like a massive chess board, black and white squares, where figures of men are moving about the board. I know this is a 'global game' and ask Old Master what this is. He says ""You will find out"". At this point I literally TRIP (like when you trip over a door jamb) back awake, in my own bed. My only feeling/thought was ""wow, what was that!"" - it was so real!",lover
"Dreamt my daughter, who is a mentally disabled adult, was playing with a full grown lion, telling him to lay down, and she would sit on him and comb his hair, and I kept feeling nervous and thinking what if he snaps and kills her, but he just obeys, as if knowing that she is special and fearless. The next moment he turned white as she was brushing him.",everyman
"I went back in time met Eddie veddar (singer of Pearl Jam) when he was 15 (way before he was a famous singer) - like any group of kids we were all hanging out in a parking lot and in coffee shops - I tell him about his life that is about to happen and tell him to look me up in the future I tell him that his first hit song is “alive” second hit is song is called “black” and tell him about Seattle and the grunge scene; that he’ll join a band out there to replace a singer who dies which caused the guitarist to write some of the most touching music of a generation and your deeply disturbing childhood with your dad influences your writing in such an impactful way that the world takes notice. He says he’s been to Seattle before. I keep getting harassed by a group of dudes aggressively during this night of otherwise seemingly meaningless interactions hanging out. They’re Trying to intimidate me targeting me for some reason. Sticking trash in my pocket. This type of stuff happened to me in high school in real life. In the dream one of them, Mocks sticking a shiv in my neck by surprise and then the dude confronting me says, see what he just did that’s what you’re gonna get if you don’t give me your phone. Since this is back in time, there were no iPhones, I had an iPhone which no one knew about. It was out of place with everything else occurring. Wierd... like the dream was trying to get rid of my future tech. Nobody knows about coffee tea and I start a trend pointing out that it’s a cool place to hang and chill so all of a sudden a lot of people are there and it’s still just like a normal occasion type of feeling. I meet this dude named chip who is actually a guy I knew much later in my life who was in a band, very talented but not famous just local cool guys in a local ska band, in the dream it’s when he’s 15 years old, same age as Eddie Veddar in this dream. I didn’t know him in real life at that age. I have weed and I tell him we’ll hang out. We hit it off like we always did in real life. There’s a band playing that is basic and blah and im hanging out with a whole group at a table. Just kids and Eddie veddar is just one of the guys in our crew obviously not important yet except to me since I knew the future. I keep talking to him about his life. I tried writing it down for him to keep, but in the dream I can’t seem to get my hand to write letters. He has like a friend/brother who’s not interested wearing a mask like today except in the dream it’s not for Covid it’s just a fashion statement, but Eddie is interested in talking. We keep talking. I keep getting jumped by this really pissed off group of guys with one dude in it who is very skittish... he’s the one who mocks sticking a shiv in my neck to let me know that could’ve been real and if I don’t confirm, next time it will be real. I escape through a small service window and That one skittish guy follows me outside where it’s just us so I get a little more brave and start boxing him. Except in the dream I can’t seem to throw an actual punch it’s slow motion no impact. But he compliments my left hook and starts being complimentary in submissive psychopathic way.",everyman
"I had a dream I was trying to cross a river of sorts, except as I went one way, all of a sudden a crocodile appeared. Panicked, I went in the other direction only to find more crocodiles circling. Fuck this shit I’m out, I thought to myself, so I yeeted myself onto this yellow-green log (it was high ground compared to where the crocs were) but out of nowhere the log turned into the biggest croc of them all and had red eyes. I remember thinking and feeling like there was nothing I could do at that point.",everyman
"The setting was present-day at our house at the time. My father's job involved international travel, so he was often away from home. When he wasn't home, my siblings and I would sleep in our parents' room with our mother. In the nightmare, we heard noise outside the room and realized a group of men broke into the house. My siblings and I ran and huddled near the door. Eventually the men broke the bedroom door. Our mother tried to block them from entering the room, so they shot her several times. She fell backwards onto the bed. That is when we scream and the nightmare gets cut. ;  Background_Info: I had a recurring nightmare. I think I was around 8 or 9 years old when it started. They happened several times when I was that age and became less frequent as I grew older. ;  Wakeup_State: Sometimes I would wake up crying. ###",hero
"I was my own future incarnation, as a girl. I was in 2036 and I was aware of my previous incarnation, which would be my current one in waking life. I knew I was a man called Alberto and that in 2020 I died at the entrance of a church because the ceiling collapsed. I was also aware who my family members were, and I knew they reincarnated with me as my new family members. It was a weird sensation not being tied to one identity, but knowing of having had one before that was totally different.",everyman
"I am together with a middle aged woman, an older man, and a younger woman. It appears that either myself, or the older man, looks exactly like Jordan Peterson and is a psychologist. We are fully dressed but laying on a double bed. Suddenly I realize that I am being subjected to a complicated deception. Everything they say is calculated to hide the fact that I have been kidnapped. The man almost immediately realize that I now know. He gets up and escape. I knock out the older woman by banging her head on the bedpost. As I do this I am struck by admiration for the genius she has displayed throughout the deception. The younger women does not feature in the rest of the dream. I hunt the man through a quiet suburban area until I am stopped by a police officer, who refuses to listen to my explanations that I am already working with the police, as a psychologist. It is only when the police officers I have contacted start arriving at the villa where I was being held that he releases me, but by then it is to late, and the criminal has escaped. I walk back to the nearby city centre. Walking aimlessly through the streets of the city, until go down below the street, into a concrete tunnel. The floor of the tunnel consists of cobblestones over which a stream of water flows. This is the Wash, the underground river, and this is London. ;  Background_Info: I wake up thinking that while the culture and entertainment available in London is unsurpassed, this remains undoubtedly the worst place in the world to live. ;  Wakeup_State: __ ###",hero
"I had a dream I was really drunk and I was walking in the street because I needed to get something, I’m not sure what but I was in my pijamas and I was really nervous I didn’t want people to see me, but heaps of people were out and then I heard a voice asking if I’m alright and I suddenly fainted and a male introduced himself as a nurse and started checking me and said I have a hole in my chest and told me to inhale and exhale but it was hard for me to take deep breaths.",everyman
"I was downstairs watching tv with my daughter (baby) and suddenly at the back of tv, a fire starts and it spreads quickly. I grab my daughter but bang my leg on the cabinet as I turn and then I go to run out the house. As I’m running out the house with my daughter in my arms, I call the dog and dog runs out with us and the fire also quickly follows behind us. I’m assuming we were the only ones in the house as I didn’t see my other children or my mother/brother who we also live with. I try to call 999 but I keep calling 969 instead by accident. My neighbour appears at their door and runs in to get their phone.",hero
I dreamed last night that the world was literally coming to an end and that the president (who was Obama in my dream) had set a detonator in the core of the Earth for it to explode at 7AM because the Earth was just in such bad shape it wasn't worth saving. I was crying horribly and holding on to my animals. I also was feeling really upset that my hibiscus was going to die also. ;  Background_Info: Loved ones not included in the dream. ;  Wakeup_State: __ ###,everyman
"Had this dream where I was at the car wash. So I could get my car washed. There was a car in front of mine. The whole thing exploded before my eyes. I pulled up and the attendent said he did not belong. He had me pop my hood, hosed the engine then had me go through. He said I'm fine and I went through. When I came out I was on a bicycle and a Ghostbuster. My first job was recruit people and bust a cave witch, her husband who is a Djinn and their children.",everyman
"I was inside a house with people I knew. Something happened to all those people (not like they were all murdered, but, like they just weren’t there anymore). I came to the cognitive realization that I had lost everything and walked outside onto the grass where it was sunny and pleasant. There was a male friend who I never fully recognized with me outside but I think it was one of my older brothers. I then made the decision to end things (this was cognitive and not done out of despair or sadness) so I took a long toothpick and inserted it through the top of my head into my brain. It felt strange but nothing happened.I then panicked and tried to reverse the decision by pulling the toothpick out(which I knew would harm me). As soon as I pulled it out I got extremely light headed, fell to my knees, and, then onto my face in the grass. The person with me engaged in friendly conversation the whole time until the end, but I don’t remember anything about the conversation.",jester
