dream,archetype
"I was at my ex bfs house “we split in real life 1.5 years ago, I had to leave because of DV” so in my dream I was at his house but it was mine. I think I was in school had to study or something. My study buddies came over and they FLEW over. I thought it was so cool and this guy can’t remember a face, taught me how to fly. I started flying everywhere around the neighborhood!! I saw him do a flip, so I tried one but I immediately fell to the ground because I was to fat. He told me to fly better I had to lose some weight. I then proceeded to fly around. I flew to the neighbors and started swinging one arm on a tree and they where shocked I could fly. I told him I got the vaccine moderna shot and if he got it to he may also be able to fly. Anyways now I’m back at home inside and there is a fight across the street and the guy has a gun. I had to hurry and get my mom, neice and someone else inside this car but it was like a clown car. We all got in and I made them stay real quiet and I hurried it out the front door and down the street, it was so stressful. In real time I woke at 5AM to a beeping in my ear like a car door for 5 seconds, that freaked me out and I started thinking I was hearing things so I didn’t go back to sleep till 6. Then I went back to sleep for 2 hours, I just woke up BUt! For the first time in my dream something wierd happened. I was hanging with my brother, (prior to this part of my dream I was doing something but I can’t remember what I was doing.)we where In his van and I STARTED TELLING HIM ABOUT MY DREAM… from when before I woke at 5AM so crazy! Then I went on to someone breaking into my car and she stole my stuff, she was homeless and with other people but also lives in a sober house. She gave me back one pair of shoes and I finally got the other one from her after threatening her. I took the box home and they where diff shoes. I took them back to her and freaked out on her yelling. Her and her friends started looking for the shoe. It was taking forever; she got in my face and I told her to get out of my face or I would fight her. She didn’t so I punched her but it was a slow punch, I hit her face where her glasses where and didn’t think it hurt her but she said OWE and started crying. We where all of a sudden in her sober house and I was talking a bunch of smack to her and her friends calling them low life’s. Then I told them to go get a drug and alcohol assessment and I helped them with resources the girl that needed to find my shoe left to find my shoe in a golf cart full of her stuff. So I asked her roommate where her other stuff was and she showed me bexause I was going to take some of her stuff as collateral until she got me my shoe. But it was all baby stuff and I didn’t wanna take her baby stuff. All of a sudden I was on the roof my mom was there and someone else idk who and I thought I was to fat for the roof and I was going to break it. Then all of a sudden it was not my real mom but it was my street mom and she was nice and helped me and showed me where the girls food was. I messed up her cupboards and took some of her food. (I have clients in real life for my job) one of my clients I haven’t heard from was in my dream and I told her you neeed to call me you are not in compliance and she shut the door on me. I was irritated but I left and remember thinking in my dream about daily stuff it’s wierd. Anyways I walk outside and it’s like a beautiful Christmas wonderland and these 2 men said hello to me really nice but I felt like they where only nice bexause they wanted me to buy things from the venders at the park… it was snowing.",lover
"I was in my car with my window half open. On my left side a little bit up the road I seen a tractor on the banks of the river. It was somehow spraying muddy water from the back, as if it was trying to get unbogged. I knew what was going to happen as I passed the tractor, so I took a deep breath and held it for a second as I got sprayed on the side of my face through my open window. Then I looked in the mirror and I got a little bit giggly because of the incident.",jester
"I was parking my car quickly as I was just dropping into a garage to ask something. So reversing in but found myself not in a bay because somehow the lines were reflections from something , rather than drawn lines, which my car obscured so I pulled back out and reversed back into what was now a space. A man was stood washing cars next to where I was as this was happening. I had to also at the same time do a school drop off and met a family where the mum was carted around on a stretcher which was more like a ping pong table , but with felt fabric, in size and quite low to the ground. She was cut in half by her hips. Sort of squashed rather than a clean cut. There was no blood just brown marks and some missing body parts were spread about randomly on the stretcher. She was naked but she looked like a mannequin. Her husband and children were with her. ;  Background_Info: In waking life I am torn and my way forward is uncertain. I am trying to change my career path and work pattern and I worry about the future a little bit.  The school drops offs end this summer which is why I am able to do these changes in real life.   ;  Wakeup_State: __ ###",explorer
"I heard a voice say ""Do you want to know why of all numbers, 3 is what was, is and will be?"". Then I had an infinitesimal glimpse of something big, unexplainable, trascendental and I woke up. I woke up before experiencing it fully because I was afraid it would drive me nuts. That voice that spoke, was at the same time coming from me and someone else. ;  Background_Info: I just had a very short but, I believe, important experience. I was suspended between a wake and sleep state. ;  Wakeup_State: __ ###",explorer
"I was at some kind of archeological dig. The man leading the dig had a daughter, a beautiful woman about my age, and after playing hard to get, she decided she really liked me. Later in the dream, I met another beautiful woman, also my age, who also really liked me. This made the situation difficult, since I had to decide which one to hurt. It wasn't a pleasant choice. In the end, I chose the second woman.  Now, I associate these women with my anima. What does anyone here think about this? Does this indicate some kind of ""split?"" Another detail is that the first woman had dark hair, and the second woman had light hair. Normally, I find dark-haired women more attractive, yet I chose the light-haired one. What do you all think? Why would I have to choose to hurt one? Is this related to my recent re-connection?  Later in the dream, I found myself next to a well. A man standing there said that it was pretty cold. Even though it was cold in my room as I was sleeping, in the dream, I suddenly felt hot. I looked down into the well, and saw ice floating in the water there. I drew up the bucket, and doused myself with it, which was very refreshing.",lover
"The person I dated, who broke up with me and wanted to get together later with me came to me in my dream. We are in the same place, they wave at me to get my attention. I tell them “Hi, nice to see you but I can’t talk. I’m late to pick up my kid from daycare.” They keep saying something I can’t understand, and I’m in a rush and get to my car. I then find the car has been hit / is dented and the tires are flat. This person is gone and I’m stuck there. ;  Background_Info: I dated someone in 2015. The person broke up with me out of nowhere, when things were going pretty well. Over the phone, mind you. We were both young and this person wasn’t ready to settle down. This person was perfectly decent and I cared for them a lot, at the time. I was heartbroken, but I moved on. This person reached out to me in 2016 to apologize, but I immediately cut them off, and respectfully told them I was doing great, had moved on and wasn’t interested in their apology, friendship or otherwise. I wished them a beautiful life, sincerely and wholeheartedly. ;  Wakeup_State: The next morning, out of curiosity, I type their name on Facebook and after some digging, I find out they died unexpectedly last summer. Young, seemingly healthy person. Poof gone.  Now, I’m here feeling sad and spooked. ###",everyman
"Everything was calm and I was at a theme park, I don’t know if I was alone or with a friend, and all of a sudden as I get on a roller coaster… A giant maybe 30 foot tall spider boards the track and proceeds to chase and derail the roller coaster causing it to crash and burn I remember the ride being torn apart and people being eaten and as the spider approached me. ;  Background_Info: A dream from when I was younger. ;  Wakeup_State: __ ###",rebel
"I was at some kind of archeological dig. The man leading the dig had a daughter, a beautiful woman about my age, and after playing hard to get, she decided she really liked me. Later in the dream, I met another beautiful woman, also my age, who also really liked me. This made the situation difficult, since I had to decide which one to hurt. It wasn't a pleasant choice. In the end, I chose the second woman.  Now, I associate these women with my anima. What does anyone here think about this? Does this indicate some kind of ""split?"" Another detail is that the first woman had dark hair, and the second woman had light hair. Normally, I find dark-haired women more attractive, yet I chose the light-haired one. What do you all think? Why would I have to choose to hurt one? Is this related to my recent re-connection?  Later in the dream, I found myself next to a well. A man standing there said that it was pretty cold. Even though it was cold in my room as I was sleeping, in the dream, I suddenly felt hot. I looked down into the well, and saw ice floating in the water there. I drew up the bucket, and doused myself with it, which was very refreshing.",lover
"I dreamt of going to the USA to visit this lady off a page I follow. I don’t know how I got there because I didn’t have a passport, and mind me I’d just woken up and I was there. I remember having a coronary about the fact that my mum would freak If she knew I was in a completely different country. But anyway, I was there with this lady and we’re chatting (I can’t remember what we were talking about though). After that I was back at this place I was supposed to be staying at and I remember talking to the people who were in the house. I was saying that I don’t know how I got there without a passport and not sure how I’ll get back either. Then a lady replied with I don’t care then all of a sudden a memory appeared in my head of being at the airport but they hadn’t even asked for my passport and let me through. I don’t remember how but all this stuff we have here was at this place I was staying at and I saw these two cats that looked exactly like mine. I was worried that they were my cats and how I was gonna take them back along with this Ute and all the rest of it. So In the next part of this dream I was with the lady again and we were travelling back via MK II Oppressors (futuristic bike that can hover and fly). We travelled back through some mountains and remember seeing these people and all this secret stuff happening. We hid so they couldn’t see us and when they left I noticed diamonds. After that we continued on our trip back to Australia. ;  Background_Info: I’ve never left the country or gone to USA and i have never spoken to the lady in the dreams. ;  Wakeup_State: __ ###",explorer
"I dream that I’m back in my childhood bedroom. It’s not the only bedroom I had in childhood, but it is the one in the home we shared with him, and the room I had through my most formative years. The room is barren, but I’m painting it a baby blue color. Suddenly I notice he’s in the room with me; I’m not sure when he came in, but when I turn around he’s painting over my blue with a dark red. I start screaming “Stop! Can’t you see I’m trying to paint it blue? Why can’t you see that? Stop!” He ignores me, and suddenly the bat I used to play softball with in the time I lived there is in my hands. I start hitting him with it, and I’m crying and saying “Please stop painting it red, I’m trying to paint it blue.” I can feel the resistance of my bat hitting him, I’m swinging as hard as I can, but I never see it hurting him. He continues to standing facing away from me as I hit him. ;  Background_Info:  I have a reoccurring dream about the man who used to molest me as a teenager and I need help to understand what it means, I feel like there has to be a reason I keep having it. ;  Wakeup_State: __ ###",everyman
"After walking up a long set of stairs, I reached a road and a bird came down and attacked a small snake hiding in some short grass. At first it looked like the bird had the snake, but the snake twisted out and got free. The bird attacked again, and this time the snake bit the bird as they were struggling. The bird dropped the snake, and the snake bit me, before the bird grabbed it again. I was initially worried, as I've encountered snakes a lot in my last job, but then realised it was probably too small to hurt me. I didn't recognise the species of bird or snake, but the snake wasnt big (30-40cm).",wizard
"It started out as me figuring out that my “best friend” in the dream was talking to my boyfriend of almost three years. I’m always either super angry or crying hysterically, this time I was crying hysterically. So when they decided to meet up I went outside and sat in his car with him just to never get answers. (In any dream he cheats I never get answers or it’s always my fault) so after I get no answers and leave, someone’s driving to my house and I’m crying really bad and I look in the back seat to like the “dream best friend” and I ask her how could she do this knowing me and him been together for three years! And I started smacking tf out of her. We get to my house and my brother falls for her the same brother that said me dating someone older is bad for the family (and he has a controlling gf) and there he is trying to get with someone younger that has the same age gap. Then I starting screaming and popping off to my brother saying like tf how is he gonna be so hypocritical! And one part of the dream I remember is calling my boyfriends phone and a girl picks up and I tell her she better find my boyfriend before I drive up to his town my self and she found him and he headed to my house ig to talk but he never tells me why he did it in my dreams unless it’s blaming me. The rest of the dream was me following my boyfriend around to get answers because he’s always running, or always finding a way out of it.",everyman
"First night of dreaming: I was running away from a day time rain, the skies were a beautiful bright blue. It was coming after me, I didn’t want it to touch me. I was jumping from roof top to rooftop in a place that resembled the favela of Brazil. Suddenly there’s a helicopter and someone who I can’t see their face reaches their hand out to me and pulls me inside before the rain could touch me. I’m dry and saved. I wake up. Second night of dreaming: I’m now wet, the rain has touched me. I’m in a forest somewhere. There’s a women who feels like a spirit. I only see her from the back, I can’t tell her age wether she’s young or old, maybe she had white braided hair and wearing native clothes. she’s running somewhere and I feel like I must follow her, so I do. She leads me to shelter. I wake up. Third night of dreaming: I’m alone and dry. I’m on a beach somewhere, and in the distance of the horizon is the most magical scene I’ve ever seen. There’s a massive tsunami wave touching the skies like it was reaching out for heaven, wide as the eye can see everywhere I look from left to right. It stayed in it’s place, just flowing up, it wasn’t coming after me. The sunset was shining through it, illuminating its power and beauty. I was in awe and wonder, mesmerized and unafraid. I felt empowered. ;  Background_Info: I dreamt over three consecutive nights with the element of water in it… ;  Wakeup_State: __ ###",everyman
"My sister and my dog were in grave danger? I found my sister lying on the ground, conscious, and with feeling down her leg into her toes but unable to move with a ring of blood around her neck and no one would tell me what happened to her. Also my dog was in trouble and no where to be found. It’s back burner made me sad all day? / Simaltaneously made me grateful it wasn’t real all day.",hero
"I wasn’t myself in this dream, I was a small, translucent, slime ball lol. I was super bouncy and could just bounce all over the place. The scene of the dream was like a video game level, I was contained in a giant cube-like area, and it was full of beautiful bright colors like purple, magenta, teal, and white. Super happy looking. There were tall platforms for me to jump onto and certain areas had little trampolines which would make me jump even higher. In this it was exactly like a video game, I was trying to hop away from the enemy chasing me, I was having so much fun even though I was a bit scared to get caught! In order to stay ahead, I had to try to jump on the trampolines only so I could jump faster and higher each time. At one point I accidentally landed on flat tile (looked like bathroom tile, it was shiny and cold and I still remember how it felt landing on it) and I sort of just splatted on it and didn’t bounce. I had to shimmy my way back to the trampolines to bounce again, I was super close to getting caught by the enemy, but still got away!",explorer
I had a dream that a security man had gave me $5 from My children's father to get too me in the dream and when I took the money. It changed to where I met an evil pyschic and I didn't know she was evil I took something outta her hand and I ate and I felt like all bad luck was trying to come too me after I have really had an hexs but I took them off right but In the dream it made me scared and worried.,everyman
"I fought a dragon to save my father [eyebrows raise in armchairs all over the world]. It was no noble movie dragon, but a black fetid and slimy wyrm. I knew things weren't right when through my window I saw the CN Tower had been erected in Montreal (Canadian dreams, eh?) and my first thought was 'the bomb is about to drop'. But as I fled the house, there it was, stuck on the roof like a fly on shit. I knew I wasn't safe in the open, so I tried to scare it away by shouting and throwing rocks. This only got its attention. The beast took to the air and swooped down at me. I was holding only a knife in my left hand, and as I barred the entry to my (late) father's house I tried to slash at the massive head pushing its way through the door. Luckily the skin was soft, not scaly, but still I could not do more than make it angry. When it finally forced its way in, what followed was a blur. For a few moments I tried to face it head on, taking advantage of the narrow hallway that slowed its penetration into my sanctum, but it was only a matter of time before it reached my father's room. I cannot recount all the details, you know how dreams go, but in a final desperate act I ducked into the bathroom and hid behind the door. As the dragon pushed his head into the tiny room I took advantage of the angle to thrust the knife under its chin and tore along the throat spilling so much black blood and offal that it threatened to drown me in dragon slag.",hero
"I had called my auntie on the phone her name was Bessie but she didn't answer she hasn't been answering since. She has been going back and forward to the doctor's and stuff she says she my have cancer and my granny died from it but I believe she will pull thru it. But in the dream she was shocked after I had called her when she didn't answer me and my old man that I'm with now we had went to her house and remind you! She lives in Winona Ms so we we're in saint Louis Mo, in the dream but some how I got to Winona Ms fast and went up there to see why she didn't answer her phone because in real life she hasn't been answering because she has been going back forward to the doctor's so the reason why I'm asking this me and my old man went up there she was getting out the tube and I had went in to look at the clock and she looked surprised about me coming up there with Carl so I don't know and when I call now she barely answer. ;  Background_Info: I had a dream about my auntie which my great auntie she's my grandma sister, and my granny is deacesed but anyway ;  Wakeup_State: __ ###",everyman
"Last night I dreamed that I was walking, with difficulty, along a path on a sheer mountain face, I think with someone else. Climbed up on a big, wobbly rock. I tried to make it stop wobbling, but the next thing I know I'm falling backward through space, with no end in sight. ;  Background_Info: I keep having these dreams about falling off a mountain, and of a mountain standing in my way - the same one every time. I'm in kind of a bad way, physically and emotionally.  ;  Wakeup_State: This feels like a warning, to get my act together. ###",everyman
"I was at home, it was night and there were noises on the stairs, when I got out of bed to see what it was about and I went to look at the viewfinder I saw a horse , he was running agitatedly up the stairs then he started banging his head on my door ,he wanted to break down the door and hurt me. He was mad and had red eyes. His colour was brown.",jester
"Two prominent roller rinks in my city shut down, and people are sad about it. I however discover an old abandoned facility in a wooded parkland near a river. I purchase this property and start developing the buildings. There is one building I do up for social/general skating, another I start building up as a hockey rink, and then another for skaters with half pipes, rails etc. I then start paving paths between the three buildings so you can go from one area to another without having to take off your skates.",everyman
"I was given a medallion necklace. I was free to wander around in a comfortable area, but instead chose to go downstairs to a dimly lit level. I then turned around, headed backwards behind the stairs, and picked up a shiny figurine of an angel. I placed this figurine in my medallion and turned around. The Devil stood before me. He then knelt before me and kissed my medallion. I struggled with what to do and decided to go back upstairs. The rest of my dream was spent sulking about unsatisfied on the upper level.",everyman
"I was walking through medieval cellars that were continually getting tighter, in one instance I even had to squeeze through. on the floors, there laid a number of turtles, some on their back, some about to fall, and some just lying normally. Their heads were scaly, some reminiscent of a dragon. When I got out of the cellar I found myself on a town square. It was evening, lights dim with some shadows flying around. Only one shadow was dense and round. It wore a blue and white jacket with a masquerade mask. I provocatively yelled at it ""Hey death!"" It noticed me and started slowly and ominously chasing me. Suddenly, a girl clad in a celebratory village dress. She said that ""It´s starting"" and took me inside of a room that was connected with the town square. A great iron gate with bars was closed behind me. More girls who had the same dress were inside. Clergymen started a prayer, yet I did not know the words. I felt ashamed, anxious, and the shadow was staring at me hauntingly. Then a dance started, I did not know the moves, I was being pushed around, I even pushed off a glass that broke. Everyone was dancing on the glass shards and clothes that looked like mine that weren't there before. The Clergymen were watching me disapprovingly. The women did not care, they were happy that I was trying to dance with them. After the dance, I started picking up the shards and cut myself accidentally. My blood was not dense, and it was watery. After the cut, my father called me and asked me how I was.",jester
"I was somehow involved in a murder. An acquaintance of ours (a big man) had beaten another man to death and a few of my friends and I had sort of egged him on over text message. The whole dream was the police surrounding us all, mostly old school friends, a toxic ex best friend of mine and a toxic ex boyfriend. Also my beloved grandma who has passed, had been involved! We were all surrounded by the police and about to be interrogated. I knew that if they saw my text messages or diary entries (I had a few journals lying around in a bag and in my hand etc), I was screwed. I was considering deleteting the messages or journal entries but didn't want to act like I was covering anything up. I was trying desperately to talk discreetly to my friends (with the police around us) to make sure we were on the same page about what we were going to say. I knew I was facing jail. Maybe 1-6 months. Or maybe none at all, but I was just hoping and praying I wouldn't go to jail. My main focus was my kids and them thinking I was the worst mum in the world for going to jail. I've already done a few things to disappoint them and I knew this one would just take the cake.",rebel
"i had a dream about a tsunami. i was in my old bedroom upstairs and i saw the tsunami, it broke my windows. i went to my moms room scared to tell her and she went to try and fix it but then it happened again. i ended up at my boyfriends house for some reason, to tell him something, but i had to go back to my house real quick and i realized that i couldn’t cus it could be dangerous i might get washed up.",everyman
